{
  "$schema": "https://json-schema.org/draft/2020-12/schema",
  "$id": "https://taktus.eu/contracts/shared/v1/Step.json",
  "title": "Step",
  "description": "One node of a process graph. Every step carries its method, the reason for the choice, the alternatives rejected and, for any method that can vary, a fallback. Every step that produces a result carries its exactness class; wait and human produce none and carry no class (ADR-0018). Two rules from ADR-0014 and ADR-0004 are enforced here: a step classed exact takes its result from rule or statistics only, and a step on llm or worker names a fallback. A step on ml or neural pins its model version, because that is what makes it reproducible. A step that produces a result may declare its checks from the catalogue; wait and human declare none. A human step, and a fallback to a person, may name the role that performs it and the expertise it needs; a role is never a named person, and registration requires it once the tenant has a structure (ADR-0146).",
  "type": "object",
  "properties": {
    "id": {
      "description": "Stable name of the step inside its process, lowercase with hyphens.",
      "type": "string",
      "pattern": "^[a-z][a-z0-9-]*$"
    },
    "method": { "$ref": "Method.json" },
    "reason": {
      "description": "Why this method was chosen for this step.",
      "type": "string",
      "minLength": 1
    },
    "rejected": {
      "description": "The alternatives considered and why they were not chosen. Empty when there was nothing to reject.",
      "type": "array",
      "items": {
        "type": "object",
        "properties": {
          "method": { "$ref": "Method.json" },
          "why": { "type": "string", "minLength": 1 }
        },
        "required": ["method", "why"],
        "additionalProperties": false
      }
    },
    "exactness": {
      "description": "How wrong the result may be. Required for every result-producing method, absent for wait and human (ADR-0018).",
      "$ref": "ExactnessClass.json"
    },
    "checks": {
      "description": "The machine checks the step declares on its result, from the catalogue of Check.json (UC-4.13). A step classed exact registers only with at least one (ADR-0082); wait and human produce no result and declare none (ADR-0018).",
      "type": "array",
      "items": { "$ref": "Check.json" },
      "minItems": 1,
      "uniqueItems": true
    },
    "role": {
      "description": "The role of the tenant's structure that performs a human step. Never a named person (principle 14, ADR-0146). Only on a human step.",
      "type": "string",
      "pattern": "^[a-z][a-z0-9-]*$"
    },
    "expertise": {
      "description": "What the work needs the person of the role to know, as short phrases. Needs role (ADR-0146).",
      "type": "array",
      "items": { "type": "string", "minLength": 1 },
      "minItems": 1,
      "uniqueItems": true
    },
    "fallback": {
      "description": "Where the step goes when the chosen method is not good enough. Mandatory for llm and worker.",
      "type": "object",
      "properties": {
        "when": {
          "description": "The condition that triggers the fallback, stated so that it can be evaluated: confidence < 0.9, tests failed twice.",
          "type": "string",
          "minLength": 1
        },
        "to": { "$ref": "Method.json" },
        "role": {
          "description": "The role that takes the step over when the fallback goes to a person. Never a named person. Only when to is human (ADR-0146).",
          "type": "string",
          "pattern": "^[a-z][a-z0-9-]*$"
        },
        "expertise": {
          "description": "What the person of the fallback's role needs to know. Needs role (ADR-0146).",
          "type": "array",
          "items": { "type": "string", "minLength": 1 },
          "minItems": 1,
          "uniqueItems": true
        }
      },
      "required": ["when", "to"],
      "additionalProperties": false,
      "allOf": [
        {
          "if": { "required": ["role"] },
          "then": { "properties": { "to": { "const": "human" } } }
        },
        {
          "if": { "required": ["expertise"] },
          "then": { "required": ["role"] }
        }
      ]
    },
    "model": {
      "description": "The model this step runs on, pinned as name@version. Required for ml and neural.",
      "type": "string",
      "pattern": "^[a-z0-9][a-z0-9._-]*@[A-Za-z0-9][A-Za-z0-9._+-]*$"
    },
    "requires": {
      "description": "Capabilities the executing adapter must offer. Never a product name.",
      "type": "array",
      "items": { "$ref": "Capability.json" },
      "uniqueItems": true
    },
    "depends_on": {
      "description": "Steps of the same process that must finish before this one starts. The edges of the graph.",
      "type": "array",
      "items": { "type": "string", "pattern": "^[a-z][a-z0-9-]*$" },
      "uniqueItems": true
    }
  },
  "required": ["id", "method", "reason", "rejected"],
  "additionalProperties": false,
  "allOf": [
    {
      "if": { "properties": { "method": { "$ref": "Method.json#/$defs/producing" } } },
      "then": { "required": ["exactness"] }
    },
    {
      "if": { "properties": { "method": { "$ref": "Method.json#/$defs/nonProducing" } } },
      "then": { "not": { "anyOf": [{ "required": ["exactness"] }, { "required": ["checks"] }] } }
    },
    {
      "if": { "properties": { "method": { "$ref": "Method.json#/$defs/variable" } } },
      "then": { "required": ["fallback"] }
    },
    {
      "if": { "properties": { "method": { "$ref": "Method.json#/$defs/pinned" } } },
      "then": { "required": ["model"] }
    },
    {
      "if": { "required": ["exactness"], "properties": { "exactness": { "const": "exact" } } },
      "then": { "properties": { "method": { "$ref": "Method.json#/$defs/exactAdmissible" } } }
    },
    {
      "if": { "anyOf": [{ "required": ["role"] }, { "required": ["expertise"] }] },
      "then": { "properties": { "method": { "const": "human" } } }
    },
    {
      "if": { "required": ["expertise"] },
      "then": { "required": ["role"] }
    }
  ]
}
