{
  "id": "book-amount",
  "method": "rule",
  "reason": "the booked amount must equal the document total, the order and the payment received; that is a check, not a judgement",
  "rejected": [
    {
      "method": "llm",
      "why": "a number produced by a language model never reaches the accounting journal"
    }
  ],
  "exactness": "exact",
  "checks": [
    {
      "kind": "reconciliation",
      "subject": "the booked amount",
      "total": "the invoice total",
      "source": "documents.read"
    },
    {
      "kind": "approval",
      "subject": "the booked amount",
      "threshold": 10000,
      "role": "accounting-lead"
    }
  ],
  "depends_on": [
    "propose-amount",
    "assign-cost-centre"
  ]
}
